Source,Transcript,Vector,religion_beliefs,loved_ones,travel_culture,achievements_triumph,hobbies_interests,aspirations,cues_of_reassurance
Reddit Thread,"Mine is a small, brown stuffed rabbit named Berry. He smelled like raspberries when I took him out of the box. My Dad gave him to me when I was 7 and I slept with him by my side until about 3 years ago. My Dad used to travel a lot and he would be out of town for weeks at a time. I latched onto this rabbit as a symbol of my Dad's love for me. I was a pretty lonely kid. I had a ton of imaginary friends (I knew they were imaginary) and I pretended to be king of the toys. But Berry was always my favorite because he reminded me of my Dad when he wasn't physically around. Don't worry, no sob story, my Dad is alive/healthy and still very much a part of my life. But I think Berry got me through a tough portion of my life.",,27,1,13,15,35,6,3
Reddit Thread,"I have this skateboarding dvd of me and my friends when we were 14. 24 now and it's great to watch it every now and again. It's about 20 minutes long, the skateboarding isn't bad considering we were 14 and has a bunch of footage of us just generally pissing around. Think it's the only copy left to so id be so pissed if it was damaged.",,4,29,16,4,8,22,18
Reddit Thread,A bottle of my mothers perfume. She passed away almost 14 yrs ago. I can smell the cap and remember what it was like to hug her.,,7,1,20,24,6,12,29
Reddit Thread,"There's also this thing he flicked at my head one night that I started wearing as a bracelet. It's just three little bands from one of potholder loom making kits tied together. It is ragged and ratty and discoloured from years of wear but it hasn't broken yet and will stay on my wrist until all three strands are too broken to tie back together. Hell, even one it gets to that point I'll probably just braid it into a something else to take its place.",,40,2,32,6,2,2,16
Reddit Thread,"I wear my Grandpa's service tags 24/7. I haven't taken them off since his funeral. I worry all the time that they'll be broken. I worry even more that someone will take them off if I land myself in the ER or something but not having his dog tags won't change anything. I still have the memories, and I guess the greatest loss for me would be forgetting all of that. Even if I'm not aware of the loss I have undergone. I'm sorry that I'm long winded, but I guess this was kind of cathartic. If you're curious about the service tags, my grandpa was in the Army. I lives with him from 4 to 17 years old. He passed away a few weeks before I turned 20. When I was 16, I wanted to wear the tags to school because we were talking about WWII in history (I thought my teacher would like seeing them). I asked him if he still had them, and he showed me them in his nightstand. I was kind of in awe, and I asked if I could wear them. My grandpa is not sentimental at all. He answered me by saying, ""You like them? You can keep them."" It was all very casual, but I wore them frequently up until his death. Travelling to his funeral, I wore them, but I took them off before the wake. I didn't put them back on until I returned to my hotel room after all the services were done, and I haven't taken them off since. I partially didn't wear them during the services because I didn't want one of my aunts to suddenly decide they wanted them and try to guilt me and intimidate me into giving them up. My aunts never did understand that I considered him my dad (my mom understood). I'd put up a picture, but they obviously have his identifying information on them. They're standard issue. I'm not sure if they're originals or not. They have the little indent toward the top left (when reading the tag), and on the back there is a rim. The lettering is stamped with two lines of writing. The top line is last name, first name. And the second line is his military ID (not SSN). I tested him once to see if he could remember his number because of something on NCIS (which my grandpa happened to love). The tags are in fairly good shape. There are a few dents and scratches. I wish now that I had asked for more stories about when he was in the military. Off the top of my head, the only story I can recall was when he was a private and the most disliked private was giving the duty of waking everyone up. Which just made everyone dislike him even more to the point people were constantly pulling pranks on him. Anyways, I should wrap this up... I just have a lot of fond memories of my grandpa because he was an amazing man.",,24,42,2,7,12,2,11
Reddit Thread,"My boy scout merit badge sash is my most prized possession. it holds all of what i have earned and labored for over the years, each badge has it's own memories tied to it. i remember my first badge was first aid, i am also the most proud of it. that badge tells me ""hey, if you see someone hurt it is your DUTY to help them because you have the knowledge for broken bones, compound injuries and so much more."" i have since helped teach the merit badge to others in hope they never have to use the knowledge.",,10,43,8,12,14,2,11
GPT4 Generated,"I happened upon this letter in an old thrift store—felt like destiny, y’know? It’s been with me for years now and holds a certain weight. Now, I keep it close because it’s like an anchor, grounding me through all the chaos life throws. Strangely, it feels like this letter will always carry a piece of me with it, even after I’m gone. I remember the first time I laid eyes on it; it was full of character. I’ve grown attached to it over time, almost like it’s become part of me. It’s carried memories through years of change, somehow staying constant. It’s funny how such a small thing can mean so much.",,8,1,11,4,7,37,32
GPT4 Generated,I stumbled upon this mug during a flea market visit; it was just lying there like some forgotten treasure. It’s been with me for years now and holds a certain weight.,,29,21,3,5,6,31,6
GPT4 Generated,"Found it in an old drawer at my grandma’s house, where it had sat for decades, gathering stories. It’s been with me for years now and holds a certain weight. I hold onto it because it feels like a bit of my past wrapped in the present, a piece of memory woven into my life. Someday, I hope to pass it down to someone who’ll see its worth beyond the surface. I remember the first time I laid eyes on it; it was full of character.",,2,9,9,19,48,9,4
GPT4 Generated,"An antique shop had this stone hidden in a dusty corner, and I felt it calling out to me. It’s been with me for years now and holds a certain weight. Now, I keep it close because it’s like an anchor, grounding me through all the chaos life throws. Strangely, it feels like this stone will always carry a piece of me with it, even after I’m gone. I remember the first time I laid eyes on it; it was unassuming but captivating. I’ve grown attached to it over time, almost like it’s become part of me. It’s carried memories through years of change, somehow staying constant. I can’t even explain it fully—it’s more a feeling than anything else.",,2,48,9,16,17,3,6
GPT4 Generated,I stumbled upon this mug during a flea market visit; it was just lying there like some forgotten treasure. It’s been with me for years now and holds a certain weight.,,43,1,5,32,3,15,1
GPT4 Generated,"An antique shop had this pen hidden in a dusty corner, and I felt it calling out to me. It’s been with me for years now and holds a certain weight. Even now, it’s a comfort object; somehow, it’s become part of me, a second skin almost. It’s seen more of my life than most people—moved with me from place to place, enduring all seasons. I remember the first time I laid eyes on it; it was full of character. I’ve grown attached to it over time, almost like it’s become part of me. It’s carried memories through years of change, somehow staying constant. It’s my little reminder that beauty is found in unexpected places.",,26,21,9,5,25,15,0
GPT4 Generated,"This pendant was a gift from a close friend back when I was going through a rough patch; it lifted my spirits. It’s been with me for years now and holds a certain weight. Now, I keep it close because it’s like an anchor, grounding me through all the chaos life throws. Though it’s scratched and faded, each blemish feels like a part of its charm now. I remember the first time I laid eyes on it; it was gleaming. I’ve grown attached to it over time, almost like it’s become part of me. It’s carried memories through years of change, somehow staying constant. It’s funny how such a small thing can mean so much.",,31,14,14,28,1,1,12
GPT4 Generated,"It’s a lucky charm I picked up while traveling solo, something that reminds me of the freedom I felt then. It’s been with me for years now and holds a certain weight. Even now, it’s a comfort object; somehow, it’s become part of me, a second skin almost. Though it’s scratched and faded, each blemish feels like a part of its charm now. I remember the first time I laid eyes on it; it was unassuming but captivating. I’ve grown attached to it over time, almost like it’s become part of me. It’s carried memories through years of change, somehow staying constant. It’s my little reminder that beauty is found in unexpected places.",,6,2,31,8,25,7,21
GPT4 Generated,"I happened upon this pen in an old thrift store—felt like destiny, y’know? It’s been with me for years now and holds a certain weight. I hold onto it because it feels like a bit of my past wrapped in the present, a piece of memory woven into my life. The pen was pristine once, now it’s a bit weathered, but it wears each scratch with pride. I remember the first time I laid eyes on it; it was full of character. I’ve grown attached to it over time, almost like it’s become part of me. It’s carried memories through years of change, somehow staying constant. There’s a certain magic in this object, something I can’t quite explain.",,25,21,29,8,1,10,6
GPT4 Generated,"An antique shop had this sculpture hidden in a dusty corner, and I felt it calling out to me. It’s been with me for years now and holds a certain weight. Even now, it’s a comfort object; somehow, it’s become part of me, a second skin almost. The sculpture was pristine once, now it’s a bit weathered, but it wears each scratch with pride. I remember the first time I laid eyes on it; it was full of character. I’ve grown attached to it over time, almost like it’s become part of me. It’s carried memories through years of change, somehow staying constant. It’s my little reminder that beauty is found in unexpected places.",,4,14,21,12,19,7,23
GPT4 Generated,"Found it in an old drawer at my grandma’s house, where it had sat for decades, gathering stories. It’s been with me for years now and holds a certain weight. Honestly, it’s grown into a symbol of all I cherish, and I can’t imagine parting with it. Though it’s scratched and faded, each blemish feels like a part of its charm now. I remember the first time I laid eyes on it; it was full of character. I’ve grown attached to it over time, almost like it’s become part of me. It’s carried memories through years of change, somehow staying constant. Whenever I hold it, it’s like I can almost step back in time, to when life felt simpler.",,1,23,0,0,18,10,47
GPT4 Generated,"It’s a lucky charm I picked up while traveling solo, something that reminds me of the freedom I felt then. It’s been with me for years now and holds a certain weight. Honestly, it’s grown into a symbol of all I cherish, and I can’t imagine parting with it. Someday, I hope to pass it down to someone who’ll see its worth beyond the surface. I remember the first time I laid eyes on it; it was full of character. I’ve grown attached to it over time, almost like it’s become part of me. It’s carried memories through years of change, somehow staying constant. Hard to put into words, but this piece, it just feels like... home, I guess?",,29,3,19,9,17,14,9
GPT4 Generated,"Found it in an old drawer at my grandma’s house, where it had sat for decades, gathering stories. It’s been with me for years now and holds a certain weight. I hold onto it because it feels like a bit of my past wrapped in the present, a piece of memory woven into my life. I’ve probably dropped it a dozen times, so it’s a little dinged up, but each mark has a story. I remember the first time I laid eyes on it; it was gleaming.",,1,8,6,29,28,3,25
GPT4 Generated,"This notebook was a gift from a close friend back when I was going through a rough patch; it lifted my spirits. It’s been with me for years now and holds a certain weight. Now, I keep it close because it’s like an anchor, grounding me through all the chaos life throws. I’ve probably dropped it a dozen times, so it’s a little dinged up, but each mark has a story. I remember the first time I laid eyes on it; it was gleaming. I’ve grown attached to it over time, almost like it’s become part of me. It’s carried memories through years of change, somehow staying constant. It’s my little reminder that beauty is found in unexpected places.",,0,6,46,16,7,3,22
GPT4 Generated,"I happened upon this playing card in an old thrift store—felt like destiny, y’know? It’s been with me for years now and holds a certain weight. I hold onto it because it feels like a bit of my past wrapped in the present, a piece of memory woven into my life. Though it’s scratched and faded, each blemish feels like a part of its charm now. I remember the first time I laid eyes on it; it was full of character. I’ve grown attached to it over time, almost like it’s become part of me. It’s carried memories through years of change, somehow staying constant. Hard to put into words, but this piece, it just feels like... home, I guess?",,1,43,5,37,3,8,4
GPT4 Generated,"This bottle opener was the very first thing I bought with my own money; I felt so proud. It’s been with me for years now and holds a certain weight. Honestly, it’s grown into a symbol of all I cherish, and I can’t imagine parting with it. I’ve probably dropped it a dozen times, so it’s a little dinged up, but each mark has a story. I remember the first time I laid eyes on it; it was full of character. I’ve grown attached to it over time, almost like it’s become part of me. It’s carried memories through years of change, somehow staying constant.",,50,22,11,8,3,5,1
GPT4 Generated,"My mom handed this sweater down to me on my wedding day, saying it had a legacy to uphold. It’s been with me for years now and holds a certain weight. Even now, it’s a comfort object; somehow, it’s become part of me, a second skin almost. I’ve probably dropped it a dozen times, so it’s a little dinged up, but each mark has a story. I remember the first time I laid eyes on it; it was unassuming but captivating. I’ve grown attached to it over time, almost like it’s become part of me. It’s carried memories through years of change, somehow staying constant. It’s my little reminder that beauty is found in unexpected places.",,55,12,5,18,0,1,9
GPT4 Generated,"An antique shop had this stamp collection hidden in a dusty corner, and I felt it calling out to me. It’s been with me for years now and holds a certain weight. Now, I keep it close because it’s like an anchor, grounding me through all the chaos life throws. Though it’s scratched and faded, each blemish feels like a part of its charm now. I remember the first time I laid eyes on it; it was full of character. I’ve grown attached to it over time, almost like it’s become part of me. It’s carried memories through years of change, somehow staying constant. I can’t even explain it fully—it’s more a feeling than anything else.",,1,35,4,21,0,15,24
GPT4 Generated,"I happened upon this bottle opener in an old thrift store—felt like destiny, y’know? It’s been with me for years now and holds a certain weight. It’s a quiet reminder of the beauty in small things, and that feeling of nostalgia warms my heart. Though it’s scratched and faded, each blemish feels like a part of its charm now. I remember the first time I laid eyes on it; it was full of character. I’ve grown attached to it over time, almost like it’s become part of me. It’s carried memories through years of change, somehow staying constant. Hard to put into words, but this piece, it just feels like... home, I guess?",,18,6,3,5,57,5,5
GPT4 Generated,"Found it in an old drawer at my grandma’s house, where it had sat for decades, gathering stories. It’s been with me for years now and holds a certain weight. It’s a quiet reminder of the beauty in small things, and that feeling of nostalgia warms my heart. The guitar was pristine once, now it’s a bit weathered, but it wears each scratch with pride. I remember the first time I laid eyes on it; it was unassuming but captivating. I’ve grown attached to it over time, almost like it’s become part of me. It’s carried memories through years of change, somehow staying constant. Hard to put into words, but this piece, it just feels like... home, I guess?",,24,2,9,12,12,16,25
GPT4 Generated,"An antique shop had this painting hidden in a dusty corner, and I felt it calling out to me. It’s been with me for years now and holds a certain weight. Honestly, it’s grown into a symbol of all I cherish, and I can’t imagine parting with it. It’s seen more of my life than most people—moved with me from place to place, enduring all seasons.",,25,3,5,6,30,14,17
GPT4 Generated,"Found it in an old drawer at my grandma’s house, where it had sat for decades, gathering stories. It’s been with me for years now and holds a certain weight. Now, I keep it close because it’s like an anchor, grounding me through all the chaos life throws. Strangely, it feels like this stone will always carry a piece of me with it, even after I’m gone. I remember the first time I laid eyes on it; it was gleaming. I’ve grown attached to it over time, almost like it’s become part of me. It’s carried memories through years of change, somehow staying constant. It’s my little reminder that beauty is found in unexpected places.",,6,23,18,5,34,11,2
GPT4 Generated,"Found it in an old drawer at my grandma’s house, where it had sat for decades, gathering stories. It’s been with me for years now and holds a certain weight. Even now, it’s a comfort object; somehow, it’s become part of me, a second skin almost. The sculpture was pristine once, now it’s a bit weathered, but it wears each scratch with pride. I remember the first time I laid eyes on it; it was full of character. I’ve grown attached to it over time, almost like it’s become part of me. It’s carried memories through years of change, somehow staying constant. Hard to put into words, but this piece, it just feels like... home, I guess?",,26,1,15,36,4,14,4
GPT4 Generated,"This scarf was a gift from a close friend back when I was going through a rough patch; it lifted my spirits. It’s been with me for years now and holds a certain weight. It’s a quiet reminder of the beauty in small things, and that feeling of nostalgia warms my heart. I’ve probably dropped it a dozen times, so it’s a little dinged up, but each mark has a story. I remember the first time I laid eyes on it; it was gleaming. I’ve grown attached to it over time, almost like it’s become part of me. It’s carried memories through years of change, somehow staying constant.",,12,16,11,3,24,26,9
GPT4 Generated,"It’s a lucky charm I picked up while traveling solo, something that reminds me of the freedom I felt then. It’s been with me for years now and holds a certain weight. Honestly, it’s grown into a symbol of all I cherish, and I can’t imagine parting with it. Strangely, it feels like this jacket will always carry a piece of me with it, even after I’m gone. I remember the first time I laid eyes on it; it was unassuming but captivating. I’ve grown attached to it over time, almost like it’s become part of me. It’s carried memories through years of change, somehow staying constant. Whenever I hold it, it’s like I can almost step back in time, to when life felt simpler.",,15,6,7,19,19,6,27
GPT4 Generated,"Found it in an old drawer at my grandma’s house, where it had sat for decades, gathering stories. It’s been with me for years now and holds a certain weight.",,44,10,4,3,7,3,30
GPT4 Generated,"It’s a lucky charm I picked up while traveling solo, something that reminds me of the freedom I felt then. It’s been with me for years now and holds a certain weight. Even now, it’s a comfort object; somehow, it’s become part of me, a second skin almost. I’ve probably dropped it a dozen times, so it’s a little dinged up, but each mark has a story. I remember the first time I laid eyes on it; it was full of character. I’ve grown attached to it over time, almost like it’s become part of me. It’s carried memories through years of change, somehow staying constant. I can’t even explain it fully—it’s more a feeling than anything else.",,20,22,2,4,29,1,21
GPT4 Generated,"I stumbled upon this chess set during a flea market visit; it was just lying there like some forgotten treasure. It’s been with me for years now and holds a certain weight. It’s a quiet reminder of the beauty in small things, and that feeling of nostalgia warms my heart. Someday, I hope to pass it down to someone who’ll see its worth beyond the surface. I remember the first time I laid eyes on it; it was unassuming but captivating. I’ve grown attached to it over time, almost like it’s become part of me. It’s carried memories through years of change, somehow staying constant. It’s my little reminder that beauty is found in unexpected places.",,1,19,21,25,3,18,13
GPT4 Generated,"My mom handed this book down to me on my wedding day, saying it had a legacy to uphold. It’s been with me for years now and holds a certain weight. It’s a quiet reminder of the beauty in small things, and that feeling of nostalgia warms my heart. Someday, I hope to pass it down to someone who’ll see its worth beyond the surface. I remember the first time I laid eyes on it; it was unassuming but captivating. I’ve grown attached to it over time, almost like it’s become part of me. It’s carried memories through years of change, somehow staying constant. It’s funny how such a small thing can mean so much.",,10,11,1,12,7,26,33
GPT4 Generated,"An antique shop had this medal hidden in a dusty corner, and I felt it calling out to me. It’s been with me for years now and holds a certain weight. Honestly, it’s grown into a symbol of all I cherish, and I can’t imagine parting with it. Strangely, it feels like this medal will always carry a piece of me with it, even after I’m gone. I remember the first time I laid eyes on it; it was full of character. I’ve grown attached to it over time, almost like it’s become part of me. It’s carried memories through years of change, somehow staying constant. There’s a certain magic in this object, something I can’t quite explain.",,15,2,9,14,33,20,8
GPT4 Generated,"Found it in an old drawer at my grandma’s house, where it had sat for decades, gathering stories. It’s been with me for years now and holds a certain weight. I hold onto it because it feels like a bit of my past wrapped in the present, a piece of memory woven into my life. Strangely, it feels like this playing card will always carry a piece of me with it, even after I’m gone. I remember the first time I laid eyes on it; it was unassuming but captivating. I’ve grown attached to it over time, almost like it’s become part of me. It’s carried memories through years of change, somehow staying constant. Hard to put into words, but this piece, it just feels like... home, I guess?",,4,12,31,7,1,23,22
GPT4 Generated,"This watch was a gift from a close friend back when I was going through a rough patch; it lifted my spirits. It’s been with me for years now and holds a certain weight. It’s a quiet reminder of the beauty in small things, and that feeling of nostalgia warms my heart. Someday, I hope to pass it down to someone who’ll see its worth beyond the surface. I remember the first time I laid eyes on it; it was gleaming. I’ve grown attached to it over time, almost like it’s become part of me. It’s carried memories through years of change, somehow staying constant.",,40,19,4,5,7,11,13
GPT4 Generated,"It’s a lucky charm I picked up while traveling solo, something that reminds me of the freedom I felt then. It’s been with me for years now and holds a certain weight. It symbolizes resilience to me, reminding me of all I’ve survived.",,5,2,12,19,7,29,25
GPT4 Generated,"An antique shop had this pen hidden in a dusty corner, and I felt it calling out to me. It’s been with me for years now and holds a certain weight. Honestly, it’s grown into a symbol of all I cherish, and I can’t imagine parting with it. I’ve probably dropped it a dozen times, so it’s a little dinged up, but each mark has a story. I remember the first time I laid eyes on it; it was full of character. I’ve grown attached to it over time, almost like it’s become part of me. It’s carried memories through years of change, somehow staying constant. It’s funny how such a small thing can mean so much.",,4,39,12,10,6,25,5
