Source,Transcript,Vector,religion_beliefs,loved_ones,travel_culture,achievements_triumph,hobbies_interests,aspirations,cues_of_reassurance
GPT4 Generated,"An antique shop had this bottle opener hidden in a dusty corner, and I felt it calling out to me. It’s been with me for years now and holds a certain weight. Even now, it’s a comfort object; somehow, it’s become part of me, a second skin almost. Though it’s scratched and faded, each blemish feels like a part of its charm now. I remember the first time I laid eyes on it; it was gleaming. I’ve grown attached to it over time, almost like it’s become part of me. It’s carried memories through years of change, somehow staying constant. It’s my little reminder that beauty is found in unexpected places.",,13,3,22,26,19,14,4
GPT4 Generated,"Found it in an old drawer at my grandma’s house, where it had sat for decades, gathering stories. It’s been with me for years now and holds a certain weight. Now, I keep it close because it’s like an anchor, grounding me through all the chaos life throws. The stamp collection was pristine once, now it’s a bit weathered, but it wears each scratch with pride. I remember the first time I laid eyes on it; it was gleaming. I’ve grown attached to it over time, almost like it’s become part of me. It’s carried memories through years of change, somehow staying constant. It’s my little reminder that beauty is found in unexpected places.",,24,18,5,8,11,11,23
GPT4 Generated,I stumbled upon this bottle opener during a flea market visit; it was just lying there like some forgotten treasure. It’s been with me for years now and holds a certain weight.,,17,4,41,9,0,19,9
GPT4 Generated,"My mom handed this compass down to me on my wedding day, saying it had a legacy to uphold. It’s been with me for years now and holds a certain weight. It symbolizes resilience to me, reminding me of all I’ve survived. Someday, I hope to pass it down to someone who’ll see its worth beyond the surface. I remember the first time I laid eyes on it; it was gleaming. I’ve grown attached to it over time, almost like it’s become part of me.",,9,8,13,5,8,40,17
GPT4 Generated,"This bracelet was the very first thing I bought with my own money; I felt so proud. It’s been with me for years now and holds a certain weight. Now, I keep it close because it’s like an anchor, grounding me through all the chaos life throws. It’s seen more of my life than most people—moved with me from place to place, enduring all seasons. I remember the first time I laid eyes on it; it was gleaming.",,4,3,37,26,21,5,5
GPT4 Generated,This compass was a gift from a close friend back when I was going through a rough patch; it lifted my spirits. It’s been with me for years now and holds a certain weight.,,1,8,8,21,7,8,47
GPT4 Generated,"My mom handed this wood carving down to me on my wedding day, saying it had a legacy to uphold. It’s been with me for years now and holds a certain weight. I hold onto it because it feels like a bit of my past wrapped in the present, a piece of memory woven into my life. It’s seen more of my life than most people—moved with me from place to place, enduring all seasons. I remember the first time I laid eyes on it; it was full of character. I’ve grown attached to it over time, almost like it’s become part of me. It’s carried memories through years of change, somehow staying constant. Hard to put into words, but this piece, it just feels like... home, I guess?",,13,25,15,5,5,3,35
GPT4 Generated,"This pocket knife was a gift from a close friend back when I was going through a rough patch; it lifted my spirits. It’s been with me for years now and holds a certain weight. Now, I keep it close because it’s like an anchor, grounding me through all the chaos life throws. Someday, I hope to pass it down to someone who’ll see its worth beyond the surface. I remember the first time I laid eyes on it; it was gleaming. I’ve grown attached to it over time, almost like it’s become part of me. It’s carried memories through years of change, somehow staying constant. It’s my little reminder that beauty is found in unexpected places.",,3,26,20,9,30,2,10
GPT4 Generated,"It’s a lucky charm I picked up while traveling solo, something that reminds me of the freedom I felt then. It’s been with me for years now and holds a certain weight. I hold onto it because it feels like a bit of my past wrapped in the present, a piece of memory woven into my life. Someday, I hope to pass it down to someone who’ll see its worth beyond the surface. I remember the first time I laid eyes on it; it was full of character. I’ve grown attached to it over time, almost like it’s become part of me. It’s carried memories through years of change, somehow staying constant. Hard to put into words, but this piece, it just feels like... home, I guess?",,39,2,23,10,11,6,10
GPT4 Generated,"This notebook was a gift from a close friend back when I was going through a rough patch; it lifted my spirits. It’s been with me for years now and holds a certain weight. I hold onto it because it feels like a bit of my past wrapped in the present, a piece of memory woven into my life. Though it’s scratched and faded, each blemish feels like a part of its charm now. I remember the first time I laid eyes on it; it was gleaming. I’ve grown attached to it over time, almost like it’s become part of me. It’s carried memories through years of change, somehow staying constant. There’s a certain magic in this object, something I can’t quite explain.",,12,6,11,29,12,12,18
GPT4 Generated,"It’s a lucky charm I picked up while traveling solo, something that reminds me of the freedom I felt then. It’s been with me for years now and holds a certain weight. It symbolizes resilience to me, reminding me of all I’ve survived. The scarf was pristine once, now it’s a bit weathered, but it wears each scratch with pride. I remember the first time I laid eyes on it; it was gleaming.",,25,8,6,33,6,20,3
GPT4 Generated,"It’s a lucky charm I picked up while traveling solo, something that reminds me of the freedom I felt then. It’s been with me for years now and holds a certain weight. Even now, it’s a comfort object; somehow, it’s become part of me, a second skin almost. It’s seen more of my life than most people—moved with me from place to place, enduring all seasons.",,7,0,7,12,51,19,3
GPT4 Generated,"This candle was a gift from a close friend back when I was going through a rough patch; it lifted my spirits. It’s been with me for years now and holds a certain weight. Even now, it’s a comfort object; somehow, it’s become part of me, a second skin almost. The candle was pristine once, now it’s a bit weathered, but it wears each scratch with pride. I remember the first time I laid eyes on it; it was gleaming. I’ve grown attached to it over time, almost like it’s become part of me. It’s carried memories through years of change, somehow staying constant. Whenever I hold it, it’s like I can almost step back in time, to when life felt simpler.",,2,10,4,40,19,11,14
GPT4 Generated,"I happened upon this book in an old thrift store—felt like destiny, y’know? It’s been with me for years now and holds a certain weight. Honestly, it’s grown into a symbol of all I cherish, and I can’t imagine parting with it. Though it’s scratched and faded, each blemish feels like a part of its charm now. I remember the first time I laid eyes on it; it was full of character. I’ve grown attached to it over time, almost like it’s become part of me. It’s carried memories through years of change, somehow staying constant. It’s my little reminder that beauty is found in unexpected places.",,30,0,12,3,2,44,8
GPT4 Generated,"I happened upon this toy car in an old thrift store—felt like destiny, y’know? It’s been with me for years now and holds a certain weight. It symbolizes resilience to me, reminding me of all I’ve survived. Strangely, it feels like this toy car will always carry a piece of me with it, even after I’m gone. I remember the first time I laid eyes on it; it was gleaming. I’ve grown attached to it over time, almost like it’s become part of me. It’s carried memories through years of change, somehow staying constant. There’s a certain magic in this object, something I can’t quite explain.",,4,29,10,4,35,7,12
GPT4 Generated,"An antique shop had this pendant hidden in a dusty corner, and I felt it calling out to me. It’s been with me for years now and holds a certain weight.",,19,53,17,1,3,5,2
GPT4 Generated,"This candle was a gift from a close friend back when I was going through a rough patch; it lifted my spirits. It’s been with me for years now and holds a certain weight. It’s a quiet reminder of the beauty in small things, and that feeling of nostalgia warms my heart. It’s seen more of my life than most people—moved with me from place to place, enduring all seasons. I remember the first time I laid eyes on it; it was gleaming. I’ve grown attached to it over time, almost like it’s become part of me. It’s carried memories through years of change, somehow staying constant. There’s a certain magic in this object, something I can’t quite explain.",,20,8,2,13,25,20,12
GPT4 Generated,"It’s a lucky charm I picked up while traveling solo, something that reminds me of the freedom I felt then. It’s been with me for years now and holds a certain weight. Even now, it’s a comfort object; somehow, it’s become part of me, a second skin almost. The chess set was pristine once, now it’s a bit weathered, but it wears each scratch with pride. I remember the first time I laid eyes on it; it was gleaming. I’ve grown attached to it over time, almost like it’s become part of me. It’s carried memories through years of change, somehow staying constant. It’s my little reminder that beauty is found in unexpected places.",,58,11,16,1,2,12,0
GPT4 Generated,"I stumbled upon this sweater during a flea market visit; it was just lying there like some forgotten treasure. It’s been with me for years now and holds a certain weight. It’s a quiet reminder of the beauty in small things, and that feeling of nostalgia warms my heart. Though it’s scratched and faded, each blemish feels like a part of its charm now. I remember the first time I laid eyes on it; it was gleaming. I’ve grown attached to it over time, almost like it’s become part of me. It’s carried memories through years of change, somehow staying constant. There’s a certain magic in this object, something I can’t quite explain.",,6,1,30,25,13,1,24
GPT4 Generated,"An antique shop had this letter hidden in a dusty corner, and I felt it calling out to me. It’s been with me for years now and holds a certain weight. Honestly, it’s grown into a symbol of all I cherish, and I can’t imagine parting with it.",,45,4,5,7,11,19,10
GPT4 Generated,"It’s a lucky charm I picked up while traveling solo, something that reminds me of the freedom I felt then. It’s been with me for years now and holds a certain weight. Honestly, it’s grown into a symbol of all I cherish, and I can’t imagine parting with it. Though it’s scratched and faded, each blemish feels like a part of its charm now. I remember the first time I laid eyes on it; it was gleaming. I’ve grown attached to it over time, almost like it’s become part of me. It’s carried memories through years of change, somehow staying constant. Whenever I hold it, it’s like I can almost step back in time, to when life felt simpler.",,4,5,1,14,58,9,10
GPT4 Generated,I stumbled upon this chess set during a flea market visit; it was just lying there like some forgotten treasure. It’s been with me for years now and holds a certain weight.,,30,7,24,17,7,9,7
GPT4 Generated,"My mom handed this keychain down to me on my wedding day, saying it had a legacy to uphold. It’s been with me for years now and holds a certain weight. Honestly, it’s grown into a symbol of all I cherish, and I can’t imagine parting with it. The keychain was pristine once, now it’s a bit weathered, but it wears each scratch with pride.",,11,15,1,1,20,2,50
GPT4 Generated,"I stumbled upon this compass during a flea market visit; it was just lying there like some forgotten treasure. It’s been with me for years now and holds a certain weight. It’s a quiet reminder of the beauty in small things, and that feeling of nostalgia warms my heart. Strangely, it feels like this compass will always carry a piece of me with it, even after I’m gone. I remember the first time I laid eyes on it; it was gleaming. I’ve grown attached to it over time, almost like it’s become part of me. It’s carried memories through years of change, somehow staying constant. It’s my little reminder that beauty is found in unexpected places.",,25,1,30,0,27,0,16
GPT4 Generated,"I happened upon this watch in an old thrift store—felt like destiny, y’know? It’s been with me for years now and holds a certain weight. Now, I keep it close because it’s like an anchor, grounding me through all the chaos life throws. The watch was pristine once, now it’s a bit weathered, but it wears each scratch with pride. I remember the first time I laid eyes on it; it was unassuming but captivating. I’ve grown attached to it over time, almost like it’s become part of me. It’s carried memories through years of change, somehow staying constant. Whenever I hold it, it’s like I can almost step back in time, to when life felt simpler.",,24,0,34,8,17,4,13
GPT4 Generated,"Found it in an old drawer at my grandma’s house, where it had sat for decades, gathering stories. It’s been with me for years now and holds a certain weight. I hold onto it because it feels like a bit of my past wrapped in the present, a piece of memory woven into my life. The bottle opener was pristine once, now it’s a bit weathered, but it wears each scratch with pride. I remember the first time I laid eyes on it; it was unassuming but captivating. I’ve grown attached to it over time, almost like it’s become part of me. It’s carried memories through years of change, somehow staying constant.",,9,15,21,4,4,36,12
GPT4 Generated,"It’s a lucky charm I picked up while traveling solo, something that reminds me of the freedom I felt then. It’s been with me for years now and holds a certain weight. Honestly, it’s grown into a symbol of all I cherish, and I can’t imagine parting with it. Though it’s scratched and faded, each blemish feels like a part of its charm now. I remember the first time I laid eyes on it; it was unassuming but captivating.",,15,12,38,3,23,3,6
GPT4 Generated,"This trophy was the very first thing I bought with my own money; I felt so proud. It’s been with me for years now and holds a certain weight. It’s a quiet reminder of the beauty in small things, and that feeling of nostalgia warms my heart. It’s seen more of my life than most people—moved with me from place to place, enduring all seasons. I remember the first time I laid eyes on it; it was unassuming but captivating. I’ve grown attached to it over time, almost like it’s become part of me. It’s carried memories through years of change, somehow staying constant. I can’t even explain it fully—it’s more a feeling than anything else.",,14,0,5,22,25,28,5
GPT4 Generated,"An antique shop had this locket hidden in a dusty corner, and I felt it calling out to me. It’s been with me for years now and holds a certain weight. Now, I keep it close because it’s like an anchor, grounding me through all the chaos life throws. The locket was pristine once, now it’s a bit weathered, but it wears each scratch with pride. I remember the first time I laid eyes on it; it was unassuming but captivating. I’ve grown attached to it over time, almost like it’s become part of me.",,4,41,14,20,18,1,3
GPT4 Generated,This sculpture was the very first thing I bought with my own money; I felt so proud.,,27,20,11,2,16,14,9
GPT4 Generated,"Found it in an old drawer at my grandma’s house, where it had sat for decades, gathering stories. It’s been with me for years now and holds a certain weight. It’s a quiet reminder of the beauty in small things, and that feeling of nostalgia warms my heart. The ring was pristine once, now it’s a bit weathered, but it wears each scratch with pride. I remember the first time I laid eyes on it; it was full of character. I’ve grown attached to it over time, almost like it’s become part of me.",,8,2,3,56,14,1,15
GPT4 Generated,"This trophy was a gift from a close friend back when I was going through a rough patch; it lifted my spirits. It’s been with me for years now and holds a certain weight. It’s a quiet reminder of the beauty in small things, and that feeling of nostalgia warms my heart. I’ve probably dropped it a dozen times, so it’s a little dinged up, but each mark has a story. I remember the first time I laid eyes on it; it was unassuming but captivating. I’ve grown attached to it over time, almost like it’s become part of me. It’s carried memories through years of change, somehow staying constant. I can’t even explain it fully—it’s more a feeling than anything else.",,15,17,30,4,19,16,0
GPT4 Generated,"My mom handed this ring down to me on my wedding day, saying it had a legacy to uphold. It’s been with me for years now and holds a certain weight. Honestly, it’s grown into a symbol of all I cherish, and I can’t imagine parting with it. Strangely, it feels like this ring will always carry a piece of me with it, even after I’m gone. I remember the first time I laid eyes on it; it was full of character. I’ve grown attached to it over time, almost like it’s become part of me. It’s carried memories through years of change, somehow staying constant. There’s a certain magic in this object, something I can’t quite explain.",,6,2,14,21,20,16,22
GPT4 Generated,"I happened upon this notebook in an old thrift store—felt like destiny, y’know? It’s been with me for years now and holds a certain weight. Even now, it’s a comfort object; somehow, it’s become part of me, a second skin almost. I’ve probably dropped it a dozen times, so it’s a little dinged up, but each mark has a story. I remember the first time I laid eyes on it; it was unassuming but captivating. I’ve grown attached to it over time, almost like it’s become part of me. It’s carried memories through years of change, somehow staying constant. It’s my little reminder that beauty is found in unexpected places.",,34,3,14,15,18,8,8
GPT4 Generated,"I happened upon this ticket in an old thrift store—felt like destiny, y’know? It’s been with me for years now and holds a certain weight. It symbolizes resilience to me, reminding me of all I’ve survived. It’s seen more of my life than most people—moved with me from place to place, enduring all seasons. I remember the first time I laid eyes on it; it was unassuming but captivating. I’ve grown attached to it over time, almost like it’s become part of me. It’s carried memories through years of change, somehow staying constant.",,54,0,1,2,27,14,2
GPT4 Generated,"This chess set was the very first thing I bought with my own money; I felt so proud. It’s been with me for years now and holds a certain weight. Even now, it’s a comfort object; somehow, it’s become part of me, a second skin almost. The chess set was pristine once, now it’s a bit weathered, but it wears each scratch with pride. I remember the first time I laid eyes on it; it was full of character.",,15,3,12,15,26,3,26
GPT4 Generated,"This pocket knife was the very first thing I bought with my own money; I felt so proud. It’s been with me for years now and holds a certain weight. It symbolizes resilience to me, reminding me of all I’ve survived.",,34,9,24,7,10,14,3
GPT4 Generated,"I happened upon this watch in an old thrift store—felt like destiny, y’know? It’s been with me for years now and holds a certain weight. Honestly, it’s grown into a symbol of all I cherish, and I can’t imagine parting with it. Strangely, it feels like this watch will always carry a piece of me with it, even after I’m gone. I remember the first time I laid eyes on it; it was full of character. I’ve grown attached to it over time, almost like it’s become part of me. It’s carried memories through years of change, somehow staying constant. It’s funny how such a small thing can mean so much.",,9,16,8,43,6,9,9
GPT4 Generated,"An antique shop had this toy car hidden in a dusty corner, and I felt it calling out to me.",,8,37,10,5,9,22,10
GPT4 Generated,"Found it in an old drawer at my grandma’s house, where it had sat for decades, gathering stories. It’s been with me for years now and holds a certain weight. Even now, it’s a comfort object; somehow, it’s become part of me, a second skin almost. The painting was pristine once, now it’s a bit weathered, but it wears each scratch with pride. I remember the first time I laid eyes on it; it was unassuming but captivating. I’ve grown attached to it over time, almost like it’s become part of me. It’s carried memories through years of change, somehow staying constant. It’s funny how such a small thing can mean so much.",,5,24,17,12,30,3,10
GPT4 Generated,"An antique shop had this sculpture hidden in a dusty corner, and I felt it calling out to me. It’s been with me for years now and holds a certain weight. It’s a quiet reminder of the beauty in small things, and that feeling of nostalgia warms my heart. Someday, I hope to pass it down to someone who’ll see its worth beyond the surface. I remember the first time I laid eyes on it; it was gleaming. I’ve grown attached to it over time, almost like it’s become part of me. It’s carried memories through years of change, somehow staying constant. I can’t even explain it fully—it’s more a feeling than anything else.",,5,30,24,3,5,27,6
GPT4 Generated,"I happened upon this locket in an old thrift store—felt like destiny, y’know? It’s been with me for years now and holds a certain weight. It’s a quiet reminder of the beauty in small things, and that feeling of nostalgia warms my heart. Though it’s scratched and faded, each blemish feels like a part of its charm now. I remember the first time I laid eyes on it; it was gleaming. I’ve grown attached to it over time, almost like it’s become part of me. It’s carried memories through years of change, somehow staying constant. Whenever I hold it, it’s like I can almost step back in time, to when life felt simpler.",,33,6,5,1,10,15,30
GPT4 Generated,"An antique shop had this bottle opener hidden in a dusty corner, and I felt it calling out to me. It’s been with me for years now and holds a certain weight. It symbolizes resilience to me, reminding me of all I’ve survived. The bottle opener was pristine once, now it’s a bit weathered, but it wears each scratch with pride. I remember the first time I laid eyes on it; it was full of character. I’ve grown attached to it over time, almost like it’s become part of me.",,8,5,12,16,9,49,1
GPT4 Generated,"It’s a lucky charm I picked up while traveling solo, something that reminds me of the freedom I felt then. It’s been with me for years now and holds a certain weight. Even now, it’s a comfort object; somehow, it’s become part of me, a second skin almost. Someday, I hope to pass it down to someone who’ll see its worth beyond the surface. I remember the first time I laid eyes on it; it was gleaming. I’ve grown attached to it over time, almost like it’s become part of me. It’s carried memories through years of change, somehow staying constant. It’s funny how such a small thing can mean so much.",,39,16,1,3,7,5,28
GPT4 Generated,"Found it in an old drawer at my grandma’s house, where it had sat for decades, gathering stories. It’s been with me for years now and holds a certain weight. Honestly, it’s grown into a symbol of all I cherish, and I can’t imagine parting with it.",,0,7,26,21,25,19,2
GPT4 Generated,"An antique shop had this ticket hidden in a dusty corner, and I felt it calling out to me. It’s been with me for years now and holds a certain weight. It symbolizes resilience to me, reminding me of all I’ve survived. It’s seen more of my life than most people—moved with me from place to place, enduring all seasons. I remember the first time I laid eyes on it; it was unassuming but captivating.",,19,2,22,30,27,0,1
GPT4 Generated,"This medal was the very first thing I bought with my own money; I felt so proud. It’s been with me for years now and holds a certain weight. It symbolizes resilience to me, reminding me of all I’ve survived. I’ve probably dropped it a dozen times, so it’s a little dinged up, but each mark has a story. I remember the first time I laid eyes on it; it was unassuming but captivating. I’ve grown attached to it over time, almost like it’s become part of me. It’s carried memories through years of change, somehow staying constant. Whenever I hold it, it’s like I can almost step back in time, to when life felt simpler.",,12,0,19,24,5,19,20
