Source,Transcript,Vector,religion_beliefs,loved_ones,travel_culture,achievements_triumph,hobbies_interests,aspirations,cues_of_reassurance
GPT4 Generated,"My mom handed this watch down to me on my wedding day, saying it had a legacy to uphold. It’s been with me for years now and holds a certain weight. Honestly, it’s grown into a symbol of all I cherish, and I can’t imagine parting with it. The watch was pristine once, now it’s a bit weathered, but it wears each scratch with pride. I remember the first time I laid eyes on it; it was unassuming but captivating.",,20,13,13,13,12,2,28
GPT4 Generated,"I stumbled upon this photo album during a flea market visit; it was just lying there like some forgotten treasure. It’s been with me for years now and holds a certain weight. Honestly, it’s grown into a symbol of all I cherish, and I can’t imagine parting with it. Though it’s scratched and faded, each blemish feels like a part of its charm now. I remember the first time I laid eyes on it; it was unassuming but captivating. I’ve grown attached to it over time, almost like it’s become part of me. It’s carried memories through years of change, somehow staying constant. Hard to put into words, but this piece, it just feels like... home, I guess?",,18,10,1,10,10,39,12
GPT4 Generated,"This mug was the very first thing I bought with my own money; I felt so proud. It’s been with me for years now and holds a certain weight. Now, I keep it close because it’s like an anchor, grounding me through all the chaos life throws. Someday, I hope to pass it down to someone who’ll see its worth beyond the surface. I remember the first time I laid eyes on it; it was unassuming but captivating. I’ve grown attached to it over time, almost like it’s become part of me. It’s carried memories through years of change, somehow staying constant. Hard to put into words, but this piece, it just feels like... home, I guess?",,10,19,1,25,6,5,33
GPT4 Generated,"This pendant was the very first thing I bought with my own money; I felt so proud. It’s been with me for years now and holds a certain weight. Honestly, it’s grown into a symbol of all I cherish, and I can’t imagine parting with it. I’ve probably dropped it a dozen times, so it’s a little dinged up, but each mark has a story. I remember the first time I laid eyes on it; it was unassuming but captivating.",,6,10,54,15,7,0,7
GPT4 Generated,"I stumbled upon this ticket during a flea market visit; it was just lying there like some forgotten treasure. It’s been with me for years now and holds a certain weight. Now, I keep it close because it’s like an anchor, grounding me through all the chaos life throws. It’s seen more of my life than most people—moved with me from place to place, enduring all seasons. I remember the first time I laid eyes on it; it was full of character. I’ve grown attached to it over time, almost like it’s become part of me. It’s carried memories through years of change, somehow staying constant.",,46,12,1,1,22,9,8
GPT4 Generated,"An antique shop had this book hidden in a dusty corner, and I felt it calling out to me. It’s been with me for years now and holds a certain weight. I hold onto it because it feels like a bit of my past wrapped in the present, a piece of memory woven into my life. Strangely, it feels like this book will always carry a piece of me with it, even after I’m gone.",,9,3,36,0,44,5,4
GPT4 Generated,"My mom handed this bracelet down to me on my wedding day, saying it had a legacy to uphold. It’s been with me for years now and holds a certain weight. It’s a quiet reminder of the beauty in small things, and that feeling of nostalgia warms my heart. Strangely, it feels like this bracelet will always carry a piece of me with it, even after I’m gone. I remember the first time I laid eyes on it; it was full of character. I’ve grown attached to it over time, almost like it’s become part of me. It’s carried memories through years of change, somehow staying constant. Whenever I hold it, it’s like I can almost step back in time, to when life felt simpler.",,46,0,17,23,9,5,0
GPT4 Generated,"I stumbled upon this scarf during a flea market visit; it was just lying there like some forgotten treasure. It’s been with me for years now and holds a certain weight. Honestly, it’s grown into a symbol of all I cherish, and I can’t imagine parting with it. I’ve probably dropped it a dozen times, so it’s a little dinged up, but each mark has a story. I remember the first time I laid eyes on it; it was unassuming but captivating. I’ve grown attached to it over time, almost like it’s become part of me. It’s carried memories through years of change, somehow staying constant. It’s funny how such a small thing can mean so much.",,9,22,18,21,0,21,9
GPT4 Generated,"This keychain was a gift from a close friend back when I was going through a rough patch; it lifted my spirits. It’s been with me for years now and holds a certain weight. I hold onto it because it feels like a bit of my past wrapped in the present, a piece of memory woven into my life. The keychain was pristine once, now it’s a bit weathered, but it wears each scratch with pride. I remember the first time I laid eyes on it; it was unassuming but captivating. I’ve grown attached to it over time, almost like it’s become part of me. It’s carried memories through years of change, somehow staying constant. I can’t even explain it fully—it’s more a feeling than anything else.",,5,20,35,8,6,17,11
GPT4 Generated,"Found it in an old drawer at my grandma’s house, where it had sat for decades, gathering stories. It’s been with me for years now and holds a certain weight. I hold onto it because it feels like a bit of my past wrapped in the present, a piece of memory woven into my life. The camera was pristine once, now it’s a bit weathered, but it wears each scratch with pride. I remember the first time I laid eyes on it; it was gleaming. I’ve grown attached to it over time, almost like it’s become part of me. It’s carried memories through years of change, somehow staying constant. Hard to put into words, but this piece, it just feels like... home, I guess?",,1,59,14,14,4,1,8
GPT4 Generated,"An antique shop had this backpack hidden in a dusty corner, and I felt it calling out to me. It’s been with me for years now and holds a certain weight. I hold onto it because it feels like a bit of my past wrapped in the present, a piece of memory woven into my life. Strangely, it feels like this backpack will always carry a piece of me with it, even after I’m gone. I remember the first time I laid eyes on it; it was gleaming. I’ve grown attached to it over time, almost like it’s become part of me. It’s carried memories through years of change, somehow staying constant. It’s funny how such a small thing can mean so much.",,12,7,7,23,17,0,34
GPT4 Generated,"I happened upon this old coin in an old thrift store—felt like destiny, y’know? It’s been with me for years now and holds a certain weight. Even now, it’s a comfort object; somehow, it’s become part of me, a second skin almost. It’s seen more of my life than most people—moved with me from place to place, enduring all seasons. I remember the first time I laid eyes on it; it was gleaming. I’ve grown attached to it over time, almost like it’s become part of me.",,1,11,17,11,46,6,8
GPT4 Generated,"It’s a lucky charm I picked up while traveling solo, something that reminds me of the freedom I felt then. It’s been with me for years now and holds a certain weight. I hold onto it because it feels like a bit of my past wrapped in the present, a piece of memory woven into my life. Strangely, it feels like this stone will always carry a piece of me with it, even after I’m gone. I remember the first time I laid eyes on it; it was gleaming. I’ve grown attached to it over time, almost like it’s become part of me. It’s carried memories through years of change, somehow staying constant. Hard to put into words, but this piece, it just feels like... home, I guess?",,19,31,7,15,13,5,11
GPT4 Generated,"I stumbled upon this locket during a flea market visit; it was just lying there like some forgotten treasure. It’s been with me for years now and holds a certain weight. Now, I keep it close because it’s like an anchor, grounding me through all the chaos life throws. Someday, I hope to pass it down to someone who’ll see its worth beyond the surface. I remember the first time I laid eyes on it; it was unassuming but captivating. I’ve grown attached to it over time, almost like it’s become part of me. It’s carried memories through years of change, somehow staying constant. I can’t even explain it fully—it’s more a feeling than anything else.",,10,33,5,21,6,6,19
GPT4 Generated,"It’s a lucky charm I picked up while traveling solo, something that reminds me of the freedom I felt then. It’s been with me for years now and holds a certain weight. It symbolizes resilience to me, reminding me of all I’ve survived. Someday, I hope to pass it down to someone who’ll see its worth beyond the surface. I remember the first time I laid eyes on it; it was full of character. I’ve grown attached to it over time, almost like it’s become part of me. It’s carried memories through years of change, somehow staying constant. It’s funny how such a small thing can mean so much.",,12,10,8,10,17,5,37
GPT4 Generated,"An antique shop had this toy car hidden in a dusty corner, and I felt it calling out to me. It’s been with me for years now and holds a certain weight. Even now, it’s a comfort object; somehow, it’s become part of me, a second skin almost. The toy car was pristine once, now it’s a bit weathered, but it wears each scratch with pride. I remember the first time I laid eyes on it; it was gleaming. I’ve grown attached to it over time, almost like it’s become part of me. It’s carried memories through years of change, somehow staying constant. Whenever I hold it, it’s like I can almost step back in time, to when life felt simpler.",,4,19,16,17,9,17,18
GPT4 Generated,"I stumbled upon this candle during a flea market visit; it was just lying there like some forgotten treasure. It’s been with me for years now and holds a certain weight. I hold onto it because it feels like a bit of my past wrapped in the present, a piece of memory woven into my life. Strangely, it feels like this candle will always carry a piece of me with it, even after I’m gone. I remember the first time I laid eyes on it; it was unassuming but captivating. I’ve grown attached to it over time, almost like it’s become part of me. It’s carried memories through years of change, somehow staying constant. Hard to put into words, but this piece, it just feels like... home, I guess?",,20,31,22,4,9,12,1
GPT4 Generated,"An antique shop had this map hidden in a dusty corner, and I felt it calling out to me. It’s been with me for years now and holds a certain weight. It’s a quiet reminder of the beauty in small things, and that feeling of nostalgia warms my heart. It’s seen more of my life than most people—moved with me from place to place, enduring all seasons. I remember the first time I laid eyes on it; it was unassuming but captivating. I’ve grown attached to it over time, almost like it’s become part of me. It’s carried memories through years of change, somehow staying constant.",,6,15,19,21,5,8,26
GPT4 Generated,This pen was a gift from a close friend back when I was going through a rough patch; it lifted my spirits. It’s been with me for years now and holds a certain weight.,,11,4,37,7,32,0,9
GPT4 Generated,"An antique shop had this bracelet hidden in a dusty corner, and I felt it calling out to me. It’s been with me for years now and holds a certain weight. It symbolizes resilience to me, reminding me of all I’ve survived. Though it’s scratched and faded, each blemish feels like a part of its charm now. I remember the first time I laid eyes on it; it was unassuming but captivating. I’ve grown attached to it over time, almost like it’s become part of me.",,11,2,4,8,35,5,35
GPT4 Generated,"An antique shop had this stone hidden in a dusty corner, and I felt it calling out to me. It’s been with me for years now and holds a certain weight. It symbolizes resilience to me, reminding me of all I’ve survived. It’s seen more of my life than most people—moved with me from place to place, enduring all seasons. I remember the first time I laid eyes on it; it was unassuming but captivating. I’ve grown attached to it over time, almost like it’s become part of me. It’s carried memories through years of change, somehow staying constant. It’s my little reminder that beauty is found in unexpected places.",,20,57,6,4,0,10,3
GPT4 Generated,"I happened upon this book in an old thrift store—felt like destiny, y’know? It’s been with me for years now and holds a certain weight. It’s a quiet reminder of the beauty in small things, and that feeling of nostalgia warms my heart. I’ve probably dropped it a dozen times, so it’s a little dinged up, but each mark has a story. I remember the first time I laid eyes on it; it was gleaming. I’ve grown attached to it over time, almost like it’s become part of me. It’s carried memories through years of change, somehow staying constant. It’s funny how such a small thing can mean so much.",,58,1,10,13,7,3,8
GPT4 Generated,This book was a gift from a close friend back when I was going through a rough patch; it lifted my spirits.,,6,12,1,1,8,68,4
GPT4 Generated,"This camera was a gift from a close friend back when I was going through a rough patch; it lifted my spirits. It’s been with me for years now and holds a certain weight. I hold onto it because it feels like a bit of my past wrapped in the present, a piece of memory woven into my life. I’ve probably dropped it a dozen times, so it’s a little dinged up, but each mark has a story. I remember the first time I laid eyes on it; it was unassuming but captivating. I’ve grown attached to it over time, almost like it’s become part of me. It’s carried memories through years of change, somehow staying constant. It’s my little reminder that beauty is found in unexpected places.",,4,12,16,1,3,43,20
GPT4 Generated,"My mom handed this stone down to me on my wedding day, saying it had a legacy to uphold. It’s been with me for years now and holds a certain weight. It symbolizes resilience to me, reminding me of all I’ve survived. Though it’s scratched and faded, each blemish feels like a part of its charm now. I remember the first time I laid eyes on it; it was gleaming. I’ve grown attached to it over time, almost like it’s become part of me. It’s carried memories through years of change, somehow staying constant. Hard to put into words, but this piece, it just feels like... home, I guess?",,15,20,28,4,11,9,12
GPT4 Generated,"I happened upon this ticket in an old thrift store—felt like destiny, y’know? It’s been with me for years now and holds a certain weight. I hold onto it because it feels like a bit of my past wrapped in the present, a piece of memory woven into my life. It’s seen more of my life than most people—moved with me from place to place, enduring all seasons.",,3,30,4,33,6,5,18
GPT4 Generated,"My mom handed this locket down to me on my wedding day, saying it had a legacy to uphold. It’s been with me for years now and holds a certain weight. It’s a quiet reminder of the beauty in small things, and that feeling of nostalgia warms my heart. Strangely, it feels like this locket will always carry a piece of me with it, even after I’m gone. I remember the first time I laid eyes on it; it was full of character. I’ve grown attached to it over time, almost like it’s become part of me. It’s carried memories through years of change, somehow staying constant. There’s a certain magic in this object, something I can’t quite explain.",,3,0,54,2,14,18,9
GPT4 Generated,"My mom handed this toy car down to me on my wedding day, saying it had a legacy to uphold. It’s been with me for years now and holds a certain weight.",,3,19,63,11,0,4,0
GPT4 Generated,"Found it in an old drawer at my grandma’s house, where it had sat for decades, gathering stories. It’s been with me for years now and holds a certain weight. Even now, it’s a comfort object; somehow, it’s become part of me, a second skin almost. The trophy was pristine once, now it’s a bit weathered, but it wears each scratch with pride.",,21,34,4,12,1,9,18
GPT4 Generated,"This wood carving was a gift from a close friend back when I was going through a rough patch; it lifted my spirits. It’s been with me for years now and holds a certain weight. I hold onto it because it feels like a bit of my past wrapped in the present, a piece of memory woven into my life.",,2,10,52,4,15,17,2
GPT4 Generated,"I happened upon this diary in an old thrift store—felt like destiny, y’know? It’s been with me for years now and holds a certain weight. Even now, it’s a comfort object; somehow, it’s become part of me, a second skin almost. Strangely, it feels like this diary will always carry a piece of me with it, even after I’m gone. I remember the first time I laid eyes on it; it was full of character. I’ve grown attached to it over time, almost like it’s become part of me. It’s carried memories through years of change, somehow staying constant. I can’t even explain it fully—it’s more a feeling than anything else.",,15,16,20,11,33,4,1
GPT4 Generated,"Found it in an old drawer at my grandma’s house, where it had sat for decades, gathering stories. It’s been with me for years now and holds a certain weight. I hold onto it because it feels like a bit of my past wrapped in the present, a piece of memory woven into my life. Though it’s scratched and faded, each blemish feels like a part of its charm now.",,10,3,4,17,17,10,40
GPT4 Generated,"It’s a lucky charm I picked up while traveling solo, something that reminds me of the freedom I felt then. It’s been with me for years now and holds a certain weight. Now, I keep it close because it’s like an anchor, grounding me through all the chaos life throws. It’s seen more of my life than most people—moved with me from place to place, enduring all seasons. I remember the first time I laid eyes on it; it was unassuming but captivating. I’ve grown attached to it over time, almost like it’s become part of me. It’s carried memories through years of change, somehow staying constant. I can’t even explain it fully—it’s more a feeling than anything else.",,5,38,16,10,7,6,18
GPT4 Generated,"This passport was the very first thing I bought with my own money; I felt so proud. It’s been with me for years now and holds a certain weight. Even now, it’s a comfort object; somehow, it’s become part of me, a second skin almost. Though it’s scratched and faded, each blemish feels like a part of its charm now. I remember the first time I laid eyes on it; it was unassuming but captivating. I’ve grown attached to it over time, almost like it’s become part of me. It’s carried memories through years of change, somehow staying constant. It’s my little reminder that beauty is found in unexpected places.",,3,5,9,30,16,29,8
GPT4 Generated,"I happened upon this passport in an old thrift store—felt like destiny, y’know? It’s been with me for years now and holds a certain weight. It symbolizes resilience to me, reminding me of all I’ve survived. Someday, I hope to pass it down to someone who’ll see its worth beyond the surface. I remember the first time I laid eyes on it; it was unassuming but captivating. I’ve grown attached to it over time, almost like it’s become part of me.",,1,38,13,12,23,11,2
GPT4 Generated,"An antique shop had this photo album hidden in a dusty corner, and I felt it calling out to me. It’s been with me for years now and holds a certain weight. Honestly, it’s grown into a symbol of all I cherish, and I can’t imagine parting with it. Though it’s scratched and faded, each blemish feels like a part of its charm now. I remember the first time I laid eyes on it; it was gleaming. I’ve grown attached to it over time, almost like it’s become part of me. It’s carried memories through years of change, somehow staying constant. It’s my little reminder that beauty is found in unexpected places.",,8,16,30,19,2,11,13
GPT4 Generated,"An antique shop had this vinyl record hidden in a dusty corner, and I felt it calling out to me. It’s been with me for years now and holds a certain weight. Now, I keep it close because it’s like an anchor, grounding me through all the chaos life throws. Someday, I hope to pass it down to someone who’ll see its worth beyond the surface. I remember the first time I laid eyes on it; it was unassuming but captivating. I’ve grown attached to it over time, almost like it’s become part of me. It’s carried memories through years of change, somehow staying constant. Whenever I hold it, it’s like I can almost step back in time, to when life felt simpler.",,4,53,5,20,12,4,1
GPT4 Generated,"An antique shop had this bracelet hidden in a dusty corner, and I felt it calling out to me. It’s been with me for years now and holds a certain weight. Even now, it’s a comfort object; somehow, it’s become part of me, a second skin almost. Though it’s scratched and faded, each blemish feels like a part of its charm now. I remember the first time I laid eyes on it; it was gleaming. I’ve grown attached to it over time, almost like it’s become part of me.",,0,13,5,48,11,1,20
GPT4 Generated,"I happened upon this photo album in an old thrift store—felt like destiny, y’know? It’s been with me for years now and holds a certain weight. It symbolizes resilience to me, reminding me of all I’ve survived. It’s seen more of my life than most people—moved with me from place to place, enduring all seasons. I remember the first time I laid eyes on it; it was unassuming but captivating. I’ve grown attached to it over time, almost like it’s become part of me. It’s carried memories through years of change, somehow staying constant. Hard to put into words, but this piece, it just feels like... home, I guess?",,15,13,36,17,11,6,2
GPT4 Generated,"It’s a lucky charm I picked up while traveling solo, something that reminds me of the freedom I felt then. It’s been with me for years now and holds a certain weight. It symbolizes resilience to me, reminding me of all I’ve survived. I’ve probably dropped it a dozen times, so it’s a little dinged up, but each mark has a story. I remember the first time I laid eyes on it; it was unassuming but captivating. I’ve grown attached to it over time, almost like it’s become part of me. It’s carried memories through years of change, somehow staying constant. It’s my little reminder that beauty is found in unexpected places.",,15,4,34,29,9,8,0
GPT4 Generated,"This toy car was a gift from a close friend back when I was going through a rough patch; it lifted my spirits. It’s been with me for years now and holds a certain weight. Honestly, it’s grown into a symbol of all I cherish, and I can’t imagine parting with it. I’ve probably dropped it a dozen times, so it’s a little dinged up, but each mark has a story. I remember the first time I laid eyes on it; it was gleaming. I’ve grown attached to it over time, almost like it’s become part of me. It’s carried memories through years of change, somehow staying constant. Whenever I hold it, it’s like I can almost step back in time, to when life felt simpler.",,21,13,15,3,1,29,18
GPT4 Generated,"This letter was the very first thing I bought with my own money; I felt so proud. It’s been with me for years now and holds a certain weight. I hold onto it because it feels like a bit of my past wrapped in the present, a piece of memory woven into my life. I’ve probably dropped it a dozen times, so it’s a little dinged up, but each mark has a story. I remember the first time I laid eyes on it; it was full of character. I’ve grown attached to it over time, almost like it’s become part of me.",,7,44,4,17,4,20,4
GPT4 Generated,"It’s a lucky charm I picked up while traveling solo, something that reminds me of the freedom I felt then. It’s been with me for years now and holds a certain weight. Now, I keep it close because it’s like an anchor, grounding me through all the chaos life throws. Strangely, it feels like this stamp collection will always carry a piece of me with it, even after I’m gone. I remember the first time I laid eyes on it; it was gleaming. I’ve grown attached to it over time, almost like it’s become part of me. It’s carried memories through years of change, somehow staying constant. Hard to put into words, but this piece, it just feels like... home, I guess?",,11,0,13,5,23,5,43
GPT4 Generated,I stumbled upon this ticket during a flea market visit; it was just lying there like some forgotten treasure.,,4,18,25,1,8,40,5
