Source,Transcript,Vector,religion_beliefs,loved_ones,travel_culture,achievements_triumph,hobbies_interests,aspirations,cues_of_reassurance
Primary Recordings,"I basically carry around a little tube of perfume. Um, the reason being that I have always travelled a lot on my own since I was like 16 or something. I, I, I left and I travel around Europe and then I travel around the world. And, I've just done that a lot through my life, but I'm super close to my family. In particular, my sister, uh, and what I used to do when I, this is my partner thinks this is a bit sad, but cause I still do it, but I used to, um, when I went in through an airport, um, I would go and spray my sister' s perfume on me. Cause I think scent is such a strong, um, you know, evoking, uh, sense. So, anyway, I still carry around, I carry around this little bit of perfume. That' s her perfume. that she gave me, it was like, um, she bought the perfume, they get little free ones. She, doesn't live in the country. That's why I never really see her.",,0,40,25,0,0,0,35
Primary Recordings,"And this was for, I went to an event and a friend of a friend ran around Iceland and so this was a raffle ticket to buy a bottle of whiskey for that event to help raise money.",,14,9,4,21,17,17,18
Primary Recordings,"I've got a necklace with two little charm things on it. And both were given to me by my mum. This is St. Christopher.So this was inherited from my grandad. And he' s the patron saint of travelling. So it' s supposed to protect me as I gothrough the world. And this is a little clover, which my mum was given for being, like, lead girl guide in the country whenshe was, like, 18. And, yeah, she gave it to me. And I think it' s got a little engraving on the back, but I can' t actuallyremember. Is it just the hallmark? Yeah, Queen' s Guide Award. In 72. Yeah, the date is...? Yeah. Yes.",,2,34,22,1,6,22,14
Primary Recordings,"If I need to choose one, I'd probably choose my ring, because it' s from my granddad. And then I got my initials engraved into it when he passed away, when I got it from him.",,7,12,10,14,0,51,7
Primary Recordings,"Okay, so this is a necklace that I got for my other grandparents when they were married for 50 years and then me and mysisters all got one with our first initial engraved and then the little heart is when my mum turned 50 and she gave that to all of us as well.",,9,7,12,26,1,1,43
Primary Recordings,"I am overly nostalgic, so much so that I don' t really like this bracelet at all, because my mum gave it to me and I wear it every day. A heart' s not really my thing, and also it used to be gold, but now it' s silver. So even though it's worn and tarnished, I will keep it on every time I get down to the building.",,11,3,10,14,14,36,12
Primary Recordings,"My earrings are covers from the late 14th century, gold, and brown dyes attached to the hoops. These are titled, from thegrad course, Design, Innovation, and Great Engineering. The abbreviation of which is DICE. And so, everything we had was DICE themed. And then I found these in my third year, and I would wear them when I used to do open dates with DICE and stuff. And my aunt used to say, look she loves DICE so much, she even has the earrings.' So I really liked it.",,10,67,3,3,0,10,7
Primary Recordings,"So I had this shirt and I bought it when I was maybe 19 from a thrift shop and on the back of it, it said, no justice, just us.And it was, yeah, pretty cringe, but it was a cool design and kind of rocked around with it for a while and saw a lot of things, that shirt. And then one day I' m going to the pub in Sydney and this huge bouncer, Maori guy, I think, I was 19,he goes, where'd you get that shirt? I was like, taken aback. I was like, what do you mean? He goes, where'd you get that shirt? And I was like, oh, thrift shop. He's like, oh, let me in. And I look on it, what the shirt means later, it's the Hell' s Angels shirt. Big Biker Gang shirt. Anyway, I still got this shirt to this day. I still rock it. So it's funny. Yeah. Okay.",,5,5,30,31,16,6,7
Primary Recordings,"Yeah, so it's a clip from American Football Pads and it's off the first set of pads I had playing American Football at university. It was banged up, I had to get it replaced, but I keep it on my keychain because it's now a sport I play a lot. It's something I think about, like starting playing the sport and it's just something to carry with because it's reflective of getting into the sport as a whole and the time and effort I've put into it as well.",,7,20,4,15,28,4,22
Primary Recordings,"Okay, okay, okay! I really like this ring; I bought it in Brighton from like a jeweler/artisan. The reason why I like this ring is because... so there's this boy band that I really like and they' ve been doing a bunch of tours but they' ve never performed in London, and then there was a show coming up it wasn't there, wasn' t there? They had announced a tourwith a certain amount of dates and locations, and there was like, ' Oh, we' re on that. We' ll announce the rest later.' And I was like, ' Oh, they're gonna announce European dates then...' l’ll go to the concert it would be fun they never announced European dates so the tour just ended up happening without them coming to Europe and then a festival was happening in London and they were on the set list for that festival so I was like okay I' ll just treat that as if it was the concert so and for this concert I wanted to like where like a themed outfit like that matched the theme of like the album that had just come out so when I was in Brighton I saw this ring I thought it really matched the concept very well because it was like a Peter Pan Neverland type of concept and I thought this looked like very fairytale -ish so I was like oh it' s cute, it will match like the theme then I got tickets for the concert, I was super excited, then the concert got cancelled, it was not great like the organization was really bad, it all got cancelled so they never came. So I' m really in the hopes that one day I' ll be able to wear it to a concert so yeah, basically that' s why I wear it.",,33,12,13,4,2,23,13
Primary Recordings,I’m wearing these beige trousers linen that i made myself and my mom taught me how to make it because she is a fashion designer actually and then they turn out a bit baggier than they were but it' s the first one that i made myself so they mean a lot to me i made them last year um they' ve whitened a little bit in the meantime which makes me sad because they were a nicer colour before but yeah i really like them um yeah i' m gonna what do they mean to me they don't they mean a lot to me it' s the first trousers that i ever made and i' m going home this weekend i' m gonna make two more.,,9,31,15,14,10,5,16
Primary Recordings,"So this is called Kadiyam in Telugu and it is called bracelet in general language. This is made of copper and it can be made of silver and gold as well, depending upon how rich you are. So the significance of this item is that it is actually worn as to safeguard oneself from evil forces in the nature. So that is the primary reason people wear it; Punjabi culture they wear it because Punjabis are naturally, they were a warrior race. They used to fight a lot of battles and they used to wear this as a symbol of their victory. Every time they won this thing, they used to imprint something that symbolizes their victory and they used to wear this. Not the number of this, the same thing, they used to imprint a symbol on the surface of this thing.",,10,26,13,6,8,4,34
Primary Recordings,"So something that one of my friends gave me when I left New Zealand was this little keychain which is made out of the clay from the beach that I grew up next to. So they went to that beach and collected a bunch of clay, processed it, somesand as well, and turned it into a little fired clay keyring thing, which I can kind of take a little piece of New Zealand with me to the UK.",,12,6,43,32,1,3,2
Primary Recordings,"So it has like it's a kind of a memorial object. And then I went to free diving in Tonga, Tonga kingdom, they have like a bunch of native people who make this kind of accessories and necklace out of the whale' s bone, so it' s kind of really interesting how this could be connected to the end life of a whale, this is how they memorialize the whale and also respect the whale, and that's why also I saw that the well there, so it Also connected to the memory that I got so, it's kind of meaningful object to me.",,15,0,6,20,21,25,13
Primary Recordings,"My ring on my pinky is from the order of the engineers. When I graduated from university, the engineering class was all inducted into the order, and you take an oath to never cause harm with anything you design. The ring is worn on the pinky of your dominant hand so that when you're writing, or doing calculations, the ring rubs against the paper and reminds you of your duty.",,23,34,1,1,28,2,10
Primary Recordings,"So I was underneath a park once, um, there was these old World War II tunnels in my hometown and um, they had been bricked up since like the 30s, 40s, um. Anyway, we found a cave so we could figure out a way to get into it; they're bricked up with 8 . 8 million blocks of clay. So we managed to crawl in and um, haul out I mean we're in there for ages but we managed to then haul out this massive, massive chunk of clay and we like crawled out really in a like quite a tough I know crawl space with this like massive brick um, and yeah, now I don' I know what to do with it, so it's hidden in the corner of my old university and I hope no one finds it; so maybe someday we can put it in a museum. Or, I get my clay, and I want to make some stuff out of that clay.",,5,7,2,13,19,23,32
Primary Recordings,"Um, yeah, the bracelet that I'm wearing, like its origin story, I guess, like my mom is super into like astrologers and things like that and the astrologer said I should be wearing a black permaline bracelet at all times and there's not a lot of things that my mom asked of me so when she was like ' hey, could you please wear this?' I said sure, yeah, so that's really the whole story behind it apparently it' s for like protection.",,11,2,21,39,4,1,22
Primary Recordings,"I've never bought fancy stuff. So, then I went for this wholesale fashion. And I picked up a fancy bag from Coach. And it's like this green, bottle green bag, which is really pretty. And it gets a lot of compliments, which I'm never used to. Because I usually don't give a shit about what I'm carrying. So, it's just a bit part of my identity. And I think I really like bottle green as an accent color now. So, I try to put in a green wherever I can in my routine.",,33,16,6,7,1,16,21
Primary Recordings,"I'll show you what I have. Whoa, in fact, actually, this is almost 10 years old now. I carry with me, it' s pretty sucked at the moment, I carry with me this. It's a business card of a Burmese monk that he gave to me on my Christmas holiday 10 years ago. And I carry that with me for good luck. I love it. Wait, tell me more about how, like, where did you get it? I was on a family holiday in Myanmar just after it opened up. And, of course, you can't visit now anymore either.It' s at war. And I met this gentleman on the airplane. We were on a little regional flight from one place in the country to another. And I was seated next to this monk. And we spoke for a bit. And he said, you know, if you ever need advice, you can contact me. And he gave me his business card. You know, he might not even be alive anymore. 10 years ago, he was a very old gentleman. Yeah, so I am sentimental about this. And I carry that with me everywhere. It’s in my wallet.",,23,6,3,32,2,12,22
Reddit Thread,"My mother's father worked for QANTAS (airline) for decades. Anyway, one day, decades ago, he notices the Beatles boarding a plane. He runs up and begs for an autograph and John Lennon whinges and bitches about it and Paul McCartney says something like, ""John, relax"" and they agree. So my grandfather gets them to sign one piece of paper for my uncle and another one for my mum, but John Lennon's pen keeps failing and he refuses to sign the second paper after the failed attempt. Paul McCartney hands him his pen and says something that equates to ""John, don't be a dick"" (it's been years since I've heard the story) and John signs it again. Ta-Da! Beatles autographs! I feel like such a name dropper.",,10,1,32,16,22,3,17
Reddit Thread,This is the first model of barbie ever made. Inherited from my grandmother.,,8,1,35,13,11,25,7
Reddit Thread,This is my space shuttle tile. It's a black coated bottom piece and was from one of the early trips when they didn't have the adhesive right and a lot of tiles dropped off. My uncle used to work on the shuttle program in the 80's.,,9,22,4,24,28,12,0
Reddit Thread,A ticket to Michael Jackson's This Is It Tour. I was going to fly all te way to London to watch that motherfucker. I really loved him so much and I NEEEDED to see him. the problem is that i live in Mexico and I was a 15 year old boy at the time so I had to find the WORST PAID JOBS EVER to get money to pay the plane and other stuff. Half way through the money gathering he died. THAT MOTHERFUCKER DIED. I cried in anger,,2,2,12,3,3,6,72
Reddit Thread,"My parents had a flood in their basement which... incidentally destroyed all my childhood photos age 7 to 21. But when I went through the boxes, I found this photograph of my grandpa who was British army during WW2 but passed away in 2001. It's a Fairbairn-Sykes Fighting Knife. My parents being lazy SOBS put all his stuff in their basement and... yeah.",,6,2,9,20,35,8,20
Reddit Thread,"My dad owns a Gibson F-4 I think mandolin made somewhere between 1906 and 1916 I can't remember where it is in there, it took a lot of research to find the date when we did. It was purchased by my Grandpa in the 50's for the steep price of 50 dollars to fool around on. It has a turtle shell pick guard as well as beautiful inlay on almost every piece of the instrument including the tuning keys. The value since then has increased immensely, but I don't think my dad or I will ever sell it. Besides the emotional attachment due to my grandfather buying it this is also a piece of history. It is one of the first instruments made by my favorite company, the people who crafted this mandolin almost 100 years ago paved the way for many of the great guitars of today which I have the honor of playing and owning. Pretty damn fascinating to me.",,9,3,3,21,9,44,11
Reddit Thread,It's a 1:1 scale replica of the endoskeleton arm in Terminator 2. There were only 750 made and I got number 743.,,6,54,12,1,0,21,6
Reddit Thread,"I have this from my father, who sadly passed away last year. He was a doctor in the rainforest in Peru for several years, travelling by boat to the most remote villages along the affluents of the Amazon River. This is a bow from a tribe way up the Tambo River, given to him by the eldest after saving his son from a severe anemia.",,14,20,37,2,1,11,16
Reddit Thread,"These are bits of Hadrian's wall, the Parthenon and the Colosseum that an uncle collected in the 70s. This is a bit of the Berlin Wall, and supposedly a bit of the Great Wall of China. They're all fairly small, about golf-ball size, and look just like bits of debris, except for the piece of the Berlin wall which has a bit of paint on it. They pretty much look like uninteresting rocks on a shelf until you realize what they are.",,0,6,9,52,5,3,24
Reddit Thread,"I have a globe that spins on its own. It was my great grandmother’s, who passed away a few months ago at the age of 93.",,8,35,29,0,21,3,4
Reddit Thread,"This is my Dad's gardening straw hat. He died 2 years ago and when I wear it, it reminds me of him.",,8,48,25,4,3,9,3
Reddit Thread,The stuffed animal my husband got me for our first Christmas together. He bought it as a filler gift but if you ask me what else I got that year I honestly wouldn’t be able to tell you. It sleeps in bed with us every night. His name is Professor Earl.,,6,16,9,13,13,20,23
Reddit Thread,"I have my dog’s ball, I was the last to hold his leash while he was among the living the last to pet him while he was still here. I still miss him sometimes. It’s basically all I have from him now.",,7,1,13,35,13,21,10
Reddit Thread,My bed frame. I made it by hand. When I first met my fiancé I was in the process of making it and my mattress was on the floor; which I was apologetic for. Something we still laugh about.,,22,18,2,15,18,8,18
Reddit Thread,Mine is my grandfathers golden marine medallion. He served in the Korean War (chosin reservoir) Legend has it that he got the gold for the medallion from the teeth of his fallen enemies.,,0,22,36,28,2,4,8
Reddit Thread,A necklace from my husband. It’s a beautiful Tahitian pearl with a tiny diamond on top. Simple and not very pricey but it’s so beautiful and I love it - probably because he picked it all by himself and I am allergic to my wedding ring so I can’t wear that.,,4,6,4,1,14,17,53
Reddit Thread,"A bandana I bought at a thrift store. I know how it sounds, but I have a hard time keeping any material item for longer than a few years. I found that bandana around 14 and wore it on a variety of ways pretty often my ex wore it a lot. I am married now and my daughter wears it. I wore it a lot pregnant. I also wore it through labor and delivery. It's a good bandana that has been through a lot with me.",,9,24,4,10,41,12,1
Reddit Thread,My late Grandmother always use to call me her 'Rose'. Before she passed away she gave me a small ceramic rose that can either be used on a necklace or bracelet. It had a few broken edges and the colour was faded. That was 15 years ago and I still keep that rose in my jewelry box.,,2,1,9,26,6,19,36
Reddit Thread,"My late Grandfather didn't like watching t.v, he would literally only watch the news at 19h00 every night and then go back to his table outside and play Boggle (word game). He would sit for hours and just play by himself, seeing how many words he can find. I had an option to choose one of his Boggle sets when he passed away. I took his oldest, most used one. The letters are so faded you can hardly see them, but that doesn't make any difference to hoe important it is. It now has a prime spot in my display case at home.",,17,15,28,2,25,6,7
Reddit Thread,"My wrist watch. My dad gave it to me when I turned 18, said that I was a man now and slapped me lightly so I would remember(and no, he hasn't seen kingdom of heaven). It's 4 years ago now and I've worn it every day since.",,42,7,7,13,7,1,23
Reddit Thread,I have a small goddess figure that's a keychain to my motorcycle key. It was my wife's pendant. She passed away. It's precious to me.,,6,0,38,34,0,1,21
Reddit Thread,I have a collection of Rubik's cubes in various sizes. I've always had one since I was a lad. I always solve one whenever I'm having a problem with anxiety. so constantly.,,20,4,25,15,2,29,6
Reddit Thread,Years and years ago my Scottish reddit secret Santa sent me a box full of random objects. Glass jar covered in Miley Cyrus stickers. Random candies. Random tiny plastic kids toys. It was weird. But I’m the middle of that was a tiny ginger guy. Kinda like a gnome. Only he was human and the size of my hand. No idea why. Kept it ever since tho.,,23,6,15,15,0,5,36
Reddit Thread,"This is a note my dad wrote me the night before my wedding.
",,9,15,2,9,6,45,14
Reddit Thread,I have a stuffed rabbit doll I’ve had since I was three. I’ve slept with her every night since. I’m 21. She’s priceless to me; I wouldn’t trade her for all the money the world could offer.,,6,10,8,3,57,3,13
Reddit Thread,"I have a ring that my ex gave me when we were still together. I still wear it to this day. I kept it in a hidden place after we broke up, but luckily found it. It's my most sentimental and priceless item I have today.",,11,11,6,11,41,3,16
Reddit Thread,"When I was 7 or 8, my parents finished renovating my room and I received a new bed set. I have been using that same blanket for the past 14 years and had it worn down, just right. It meant a lot to me (I couldn’t tell you why), but when I had come home to find my puppy had torn it to shreds some time throughout the day, I was devastated. They just don't make blankets like that anymore.",,10,47,3,18,9,13,0
Reddit Thread,"I have this stuffed tigger that i absolutely adore. He fits perfectly in my hand and i hold him every night. If he’s not in my hand, i have a hard time falling asleep. I’ve had him since I was 4 months old & im 20 now so he’s been through it all. That’s why i will never get rid of him. He’s come with me on most trips/vacations/camps, even to school and honestly I’ve probably taken him with me to the grocery store. He’s lost all of stripes, his color has faded a little and his head flops down now but that’s what gives him personality!",,7,10,15,6,5,39,18
Reddit Thread,"When I got into photography in my teens, my dad gave me his old SLR from the 70s. Heavy as hell and cumbersome, but I took all my photos with it. My parents don't have much to pass down to me, so I cherish it even if I don't use it as much anymore.",,9,5,2,7,44,31,2
Reddit Thread,I have a blouse from 1910 that is from France. It fits me and the amazing thing is that you can tell it was handmade for a particular person because of how it fits. It probably survived both world wars and it's something that I'm so glad to have to study and wear to reenacting events.,,4,1,2,14,25,13,41
Reddit Thread,"My grandmother who died recently gave me at the age of eight a real amethyst. She said that this amethyst is from Morocco and at the age of eighteen years old, when I am an adult in my country, to make from that amethyst a bracelet/ necklace/ring/earrings. At her funeral I said in my head that I'm going to make that amethyst a legacy for my future generations and I know that she will be proud of me for this decision that I made.",,12,5,0,8,1,8,65
Reddit Thread,This is my son's birth certificate from the hospital on the day he was born. The one with his foot prints on it.,,1,13,41,21,3,13,7
Reddit Thread,"I have this purse from Easter when I was 8 years old. I loved it so much. It was a hard time in our lives and my mother didn't have much, but she thought it was important that I had that. I periodically look at it and think I should get rid of it, so my kids don't have to. But it just brings up so much fond memories of having been cared about.",,28,17,9,1,16,0,28
Reddit Thread,I have my late mother's feather pillows which I couldn't bear to throw away because they smelled of her.,,8,2,11,5,4,15,55
Reddit Thread,"It's a 3 inch long china baby doll, jointed arms and legs. My maternal grandmother gave it to me when I was about 7, telling me she had been given it at the same age from an old lady who had the thing when SHE was herself a child. I would guess the thing is about 120 to 150 years old? No real idea.",,6,11,22,17,20,7,17
Reddit Thread,"I have a heart-shaped locket that my grandfather gave to my grandmother before he could afford her engagement ring. It's engraved on the back with their names, and old pictures of them on the inside. My oldest daughter wore it at her wedding.",,4,18,43,22,7,0,6
Reddit Thread,"This is a drawing given to me by a girl who I once loved. It is a drawing of a Evo and 350z facing a white sun rising in the East. Every morning I see this drawing hanging on West wall of my room and I ask myself why I still have this symbol of mockery. For the purpose of remembering what it felt to be alive, and to serve as a motive to keep existing in this gloomy world. Short lived moments that live on to inspire me.",,22,11,11,5,6,5,40
Reddit Thread,"Would be my small matchbox toy car, Holden commodore rally car. It's smashed up and scuffed but it was the first toy car I ever got. I'd lose it for a few weeks and then somehow I'd find it.",,16,8,34,5,12,1,24
Reddit Thread,"My brother's confirmation cross necklace. When he died it was given to me, and is now the only thing if his I have. I only have like two pictures of him, so, it's meaningful to have this small part of him, as it was one of his most important possessions when he was alive.",,9,12,15,16,10,3,34
Reddit Thread,"My class ring from highschool. To me I have had it since I was 16 years old, several GFs have worn it and still have chips in it from when they threw it at me. This thing has seen me go from being asocial to a social butterfly and has seen me travel. Besides when the gf had worn it I've always had it on me.",,9,30,9,21,11,12,7
Reddit Thread,"A young mother with her 3 kids walked by and into the bank right near me. She was so damn stressed out as her oldest child (about 10) was holding a soccer ball and kept running out of the bank forcing her to run off after him. Eventually the ball rolled towards me and i just starting mucking around and playing keep-away with him. I nodded at the lady in a sort of ""I'll wait here with him for you"" kinda way. She was a local and had spoken to me a few times before so she knew I wasn't going anywhere. After about half an hour of mucking around she came out and he took off this little white stringy bracelet thing he was wearing (he was Kenyan and had a shit load all up his arm) and gave it to me and said thanks for playing with him. 5 years later it's still on my wrist. It wasn't even that crazy of an interaction but the kid just stuck a chord with me.",,1,5,30,2,37,24,1
